{
  "formatVersion": 1,
  "chapterId": "b2ch8",
  "sourceFile": "chapters/b2ch8.magium",
  "sceneOrder": [
    "B2-Ch08a-Intro",
    "B2-Ch08a-Intro2",
    "B2-Ch08a-Tickle",
    "B2-Ch08a-Tickle2",
    "B2-Ch08a-Situation",
    "B2-Ch08a-Precautions",
    "B2-Ch08a-Obliterated",
    "B2-Ch08a-Tornado",
    "B2-Ch08a-Tornado2",
    "B2-Ch08a-Whatever",
    "B2-Ch08a-Trailing",
    "B2-Ch08a-Imprisoned",
    "B2-Ch08a-Powers",
    "B2-Ch08a-Trade",
    "B2-Ch08a-Stuck",
    "B2-Ch08a-Alright",
    "B2-Ch08a-Informant",
    "B2-Ch08a-Defenses",
    "B2-Ch08a-Flaming",
    "B2-Ch08a-Crossbow",
    "B2-Ch08a-Assess",
    "B2-Ch08a-Goblins",
    "B2-Ch08a-Goblins2",
    "B2-Ch08a-Trees",
    "B2-Ch08a-Fight",
    "B2-Ch08a-Fight2",
    "B2-Ch08a-Retreat",
    "B2-Ch08a-Dispatches",
    "B2-Ch08a-Composition",
    "B2-Ch08a-Stronger",
    "B2-Ch08a-Inspiring",
    "B2-Ch08a-Uphold",
    "B2-Ch08a-Serve",
    "B2-Ch08a-Types",
    "B2-Ch08a-Capabilities",
    "B2-Ch08a-Bothered",
    "B2-Ch08a-Indeed",
    "B2-Ch08a-Common",
    "B2-Ch08a-Funny",
    "B2-Ch08a-Literally",
    "B2-Ch08a-Image",
    "B2-Ch08a-Unlikeable",
    "B2-Ch08a-Civilized",
    "B2-Ch08a-Terrified",
    "B2-Ch08a-Hobby",
    "B2-Ch08a-Extract",
    "B2-Ch08a-Point",
    "B2-Ch08a-Away",
    "B2-Ch08a-Lessathi",
    "B2-Ch08a-Unnoticed",
    "B2-Ch08a-Insects",
    "B2-Ch08a-Fair",
    "B2-Ch08a-Uninterrupted",
    "B2-Ch08a-Gentleman",
    "B2-Ch08a-Energizer",
    "B2-Ch08a-Energizer2",
    "B2-Ch08a-Energizer3",
    "B2-Ch08a-Sleepy",
    "B2-Ch08a-Regret",
    "B2-Ch08a-Credits"
  ],
  "scenes": {
    "B2-Ch08a-Intro": {
      "id": "B2-Ch08a-Intro",
      "blocks": [
        {
          "id": "B2-Ch08a-Intro:p1",
          "type": "paragraph",
          "messageId": "b2ch8.B2_Ch08a_Intro.p1",
          "conditions": null
        }
      ],
      "choices": [
        {
          "id": "B2-Ch08a-Intro:c1",
          "messageId": "b2ch8.B2_Ch08a_Intro.c1",
          "target": "B2-Ch08a-Intro2",
          "setVariables": [
            {
              "variable": "v_current_scene",
              "mode": "set",
              "value": "B2-Ch08a-Intro2"
            },
            {
              "variable": "v_checkpoint_rich",
              "mode": "set",
              "value": 0
            }
          ],
          "special": null,
          "conditions": null
        }
      ],
      "setVariables": [],
      "achievements": []
    },
    "B2-Ch08a-Intro2": {
      "id": "B2-Ch08a-Intro2",
      "blocks": [
        {
          "id": "B2-Ch08a-Intro2:p1",
          "type": "paragraph",
          "messageId": "b2ch8.B2_Ch08a_Intro2.p1",
          "conditions": null
        }
      ],
      "choices": [
        {
          "id": "B2-Ch08a-Intro2:c1",
          "messageId": "b2ch8.B2_Ch08a_Intro2.c1",
          "target": "B2-Ch08a-Tickle",
          "setVariables": [
            {
              "variable": "v_current_scene",
              "mode": "set",
              "value": "B2-Ch08a-Tickle"
            },
            {
              "variable": "v_b2_ch8_tickle",
              "mode": "set",
              "value": 1
            }
          ],
          "special": null,
          "conditions": null
        },
        {
          "id": "B2-Ch08a-Intro2:c2",
          "messageId": "b2ch8.B2_Ch08a_Intro2.c2",
          "target": "B2-Ch08a-Situation",
          "setVariables": [
            {
              "variable": "v_current_scene",
              "mode": "set",
              "value": "B2-Ch08a-Situation"
            },
            {
              "variable": "v_b2_ch8_tickle",
              "mode": "set",
              "value": 0
            }
          ],
          "special": null,
          "conditions": null
        }
      ],
      "setVariables": [],
      "achievements": []
    },
    "B2-Ch08a-Tickle": {
      "id": "B2-Ch08a-Tickle",
      "blocks": [
        {
          "id": "B2-Ch08a-Tickle:p1",
          "type": "paragraph",
          "messageId": "b2ch8.B2_Ch08a_Tickle.p1",
          "conditions": null
        }
      ],
      "choices": [
        {
          "id": "B2-Ch08a-Tickle:c1",
          "messageId": "b2ch8.B2_Ch08a_Tickle.c1",
          "target": "B2-Ch08a-Tickle2",
          "setVariables": [
            {
              "variable": "v_current_scene",
              "mode": "set",
              "value": "B2-Ch08a-Tickle2"
            }
          ],
          "special": null,
          "conditions": null
        }
      ],
      "setVariables": [],
      "achievements": []
    },
    "B2-Ch08a-Tickle2": {
      "id": "B2-Ch08a-Tickle2",
      "blocks": [
        {
          "id": "B2-Ch08a-Tickle2:p1",
          "type": "paragraph",
          "messageId": "b2ch8.B2_Ch08a_Tickle2.p1",
          "conditions": null
        }
      ],
      "choices": [
        {
          "id": "B2-Ch08a-Tickle2:c1",
          "messageId": "b2ch8.B2_Ch08a_Tickle2.c1",
          "target": "B2-Ch08a-Precautions",
          "setVariables": [
            {
              "variable": "v_current_scene",
              "mode": "set",
              "value": "B2-Ch08a-Precautions"
            }
          ],
          "special": null,
          "conditions": null
        }
      ],
      "setVariables": [],
      "achievements": []
    },
    "B2-Ch08a-Situation": {
      "id": "B2-Ch08a-Situation",
      "blocks": [
        {
          "id": "B2-Ch08a-Situation:p1",
          "type": "paragraph",
          "messageId": "b2ch8.B2_Ch08a_Situation.p1",
          "conditions": null
        }
      ],
      "choices": [
        {
          "id": "B2-Ch08a-Situation:c1",
          "messageId": "b2ch8.B2_Ch08a_Situation.c1",
          "target": "B2-Ch08a-Precautions",
          "setVariables": [
            {
              "variable": "v_current_scene",
              "mode": "set",
              "value": "B2-Ch08a-Precautions"
            }
          ],
          "special": null,
          "conditions": null
        }
      ],
      "setVariables": [],
      "achievements": []
    },
    "B2-Ch08a-Precautions": {
      "id": "B2-Ch08a-Precautions",
      "blocks": [
        {
          "id": "B2-Ch08a-Precautions:p1",
          "type": "paragraph",
          "messageId": "b2ch8.B2_Ch08a_Precautions.p1",
          "conditions": null
        }
      ],
      "choices": [
        {
          "id": "B2-Ch08a-Precautions:c1",
          "messageId": "b2ch8.B2_Ch08a_Precautions.c1",
          "target": "B2-Ch08a-Obliterated",
          "setVariables": [
            {
              "variable": "v_current_scene",
              "mode": "set",
              "value": "B2-Ch08a-Obliterated"
            }
          ],
          "special": null,
          "conditions": null
        }
      ],
      "setVariables": [],
      "achievements": []
    },
    "B2-Ch08a-Obliterated": {
      "id": "B2-Ch08a-Obliterated",
      "blocks": [
        {
          "id": "B2-Ch08a-Obliterated:p1",
          "type": "paragraph",
          "messageId": "b2ch8.B2_Ch08a_Obliterated.p1",
          "conditions": null
        }
      ],
      "choices": [
        {
          "id": "B2-Ch08a-Obliterated:c1",
          "messageId": "b2ch8.B2_Ch08a_Obliterated.c1",
          "target": "B2-Ch08a-Whatever",
          "setVariables": [
            {
              "variable": "v_current_scene",
              "mode": "set",
              "value": "B2-Ch08a-Whatever"
            },
            {
              "variable": "v_b2_ch8_tornado",
              "mode": "set",
              "value": 0
            }
          ],
          "special": null,
          "conditions": null
        },
        {
          "id": "B2-Ch08a-Obliterated:c2",
          "messageId": "b2ch8.B2_Ch08a_Obliterated.c2",
          "target": "B2-Ch08a-Tornado",
          "setVariables": [
            {
              "variable": "v_current_scene",
              "mode": "set",
              "value": "B2-Ch08a-Tornado"
            },
            {
              "variable": "v_b2_ch8_tornado",
              "mode": "set",
              "value": 1
            }
          ],
          "special": null,
          "conditions": null
        }
      ],
      "setVariables": [],
      "achievements": []
    },
    "B2-Ch08a-Tornado": {
      "id": "B2-Ch08a-Tornado",
      "blocks": [
        {
          "id": "B2-Ch08a-Tornado:p1",
          "type": "paragraph",
          "messageId": "b2ch8.B2_Ch08a_Tornado.p1",
          "conditions": null
        }
      ],
      "choices": [
        {
          "id": "B2-Ch08a-Tornado:c1",
          "messageId": "b2ch8.B2_Ch08a_Tornado.c1",
          "target": "B2-Ch08a-Tornado2",
          "setVariables": [
            {
              "variable": "v_current_scene",
              "mode": "set",
              "value": "B2-Ch08a-Tornado2"
            }
          ],
          "special": null,
          "conditions": null
        }
      ],
      "setVariables": [],
      "achievements": []
    },
    "B2-Ch08a-Tornado2": {
      "id": "B2-Ch08a-Tornado2",
      "blocks": [
        {
          "id": "B2-Ch08a-Tornado2:p1",
          "type": "paragraph",
          "messageId": "b2ch8.B2_Ch08a_Tornado2.p1",
          "conditions": null
        }
      ],
      "choices": [
        {
          "id": "B2-Ch08a-Tornado2:c1",
          "messageId": "b2ch8.B2_Ch08a_Tornado2.c1",
          "target": "B2-Ch08a-Trailing",
          "setVariables": [
            {
              "variable": "v_current_scene",
              "mode": "set",
              "value": "B2-Ch08a-Trailing"
            }
          ],
          "special": null,
          "conditions": null
        }
      ],
      "setVariables": [],
      "achievements": []
    },
    "B2-Ch08a-Whatever": {
      "id": "B2-Ch08a-Whatever",
      "blocks": [
        {
          "id": "B2-Ch08a-Whatever:p1",
          "type": "paragraph",
          "messageId": "b2ch8.B2_Ch08a_Whatever.p1",
          "conditions": null
        }
      ],
      "choices": [
        {